{"datasets":[{"artifacts":[{"compression":"none","distribution":"upstream-only","downloads":[{"kind":"upstream","url":"https://example.invalid/datamonger/conformance/mixed.csv"}],"format":"csv","name":"data","sha256":"8a46d390c070778b3617d11ba9a0ea0cb3516a2c54aeafdc53c9196367208c1e","size":126}],"description":"Tiny mixed-type CSV used by the language-neutral conformance suite.","license":{"identifier":"CC0-1.0","status":"known"},"modality":"tabular","name":"mixed_csv","provenance":{"landing_page":"https://example.invalid/datamonger/conformance","provider":"Datamonger","retrieved_at":"2026-08-29","upstream_name":"mixed.csv"},"representation":{"decoder":"delimited-text","decoder_version":1,"expect":{"components":[{"kind":"vector","length":5,"name":"measurement","type":"float64"},{"kind":"vector","length":5,"name":"count","type":"int64"},{"kind":"vector","length":5,"name":"label","type":"string"},{"kind":"vector","length":5,"name":"enabled","type":"bool"}],"verification":[{"algorithm":"sha256","canonical_form":1,"digest":"e25d27e8b0008332d778cd48429a7c4f7af59411884092e52f120da63f26e726"}]},"inputs":{"data":"data"},"options":{"columns":[{"name":"measurement","type":"float64"},{"name":"count","type":"int64"},{"name":"label","type":"string"},{"name":"enabled","type":"bool"}],"delimiter":",","encoding":"utf-8","escape":"double","header":true,"missing_values":[""],"quote":"\"","row_order":"source"}},"schema_version":1,"source":"conformance","title":"Mixed CSV conformance fixture","version":"1"},{"artifacts":[{"compression":"none","distribution":"upstream-only","downloads":[{"kind":"upstream","url":"https://example.invalid/datamonger/conformance/mixed.tsv"}],"format":"tsv","name":"data","sha256":"6fd6c20b84a335c8de0d7163722b20e2f3a95f1d61a6bea4395670e05f81e044","size":126}],"description":"Tiny mixed-type TSV used by the language-neutral conformance suite.","license":{"identifier":"CC0-1.0","status":"known"},"modality":"tabular","name":"mixed_tsv","provenance":{"landing_page":"https://example.invalid/datamonger/conformance","provider":"Datamonger","retrieved_at":"2026-08-29","upstream_name":"mixed.tsv"},"representation":{"decoder":"delimited-text","decoder_version":1,"expect":{"components":[{"kind":"vector","length":5,"name":"measurement","type":"float64"},{"kind":"vector","length":5,"name":"count","type":"int64"},{"kind":"vector","length":5,"name":"label","type":"string"},{"kind":"vector","length":5,"name":"enabled","type":"bool"}],"verification":[{"algorithm":"sha256","canonical_form":1,"digest":"e25d27e8b0008332d778cd48429a7c4f7af59411884092e52f120da63f26e726"}]},"inputs":{"data":"data"},"options":{"columns":[{"name":"measurement","type":"float64"},{"name":"count","type":"int64"},{"name":"label","type":"string"},{"name":"enabled","type":"bool"}],"delimiter":"\t","encoding":"utf-8","escape":"double","header":true,"missing_values":[""],"quote":"\"","row_order":"source"}},"schema_version":1,"source":"conformance","title":"Mixed TSV conformance fixture","version":"1"},{"artifacts":[{"compression":"none","distribution":"upstream-only","downloads":[{"kind":"upstream","url":"https://example.invalid/datamonger/conformance/small.libsvm"}],"format":"libsvm","name":"data","sha256":"621fd6e613189956bfea3db00e1413608c793b42001b5d75d55c87382acd4ba6","size":21}],"description":"Tiny sparse classification data used by the conformance suite.","license":{"identifier":"CC0-1.0","status":"known"},"modality":"tabular","name":"small_libsvm","provenance":{"landing_page":"https://example.invalid/datamonger/conformance","provider":"Datamonger","retrieved_at":"2026-08-29","upstream_name":"small.libsvm"},"representation":{"decoder":"libsvm","decoder_version":1,"expect":{"components":[{"columns":4,"kind":"sparse_matrix","name":"features","rows":2,"type":"float64"},{"kind":"vector","length":2,"name":"response","type":"int64"}],"verification":[{"algorithm":"sha256","canonical_form":1,"digest":"50b077922f6ffc77054622fd807fbc8de48d1c3fcb3be644027422b244b0190b"}]},"inputs":{"data":"data"},"options":{"duplicate_features":"error","feature_count":4,"index_base":1,"label_type":"int64","row_order":"source","target_name":"response"}},"schema_version":1,"source":"conformance","title":"Small LIBSVM conformance fixture","version":"1"},{"artifacts":[{"compression":"none","distribution":"upstream-only","downloads":[{"kind":"upstream","url":"https://example.invalid/datamonger/conformance/small.libsvm"}],"format":"libsvm","name":"training-data","sha256":"621fd6e613189956bfea3db00e1413608c793b42001b5d75d55c87382acd4ba6","size":21},{"compression":"none","distribution":"upstream-only","downloads":[{"kind":"upstream","url":"https://example.invalid/datamonger/conformance/small-test.svmlight"}],"format":"svmlight","name":"testing-data","sha256":"db6007bff9efaa468f44c20b485a51f92d794141dae44a490ac83aa721e7cb36","size":29}],"description":"Tiny sparse train and test data used to verify split assembly.","license":{"identifier":"CC0-1.0","status":"known"},"modality":"tabular","name":"small_libsvm_split","provenance":{"landing_page":"https://example.invalid/datamonger/conformance","provider":"Datamonger","retrieved_at":"2026-08-29","upstream_name":"small LIBSVM split"},"representation":{"decoder":"libsvm-split","decoder_version":1,"expect":{"components":[{"columns":4,"kind":"sparse_matrix","name":"train_features","rows":2,"type":"float64"},{"kind":"vector","length":2,"name":"train_response","type":"int64"},{"columns":4,"kind":"sparse_matrix","name":"test_features","rows":2,"type":"float64"},{"kind":"vector","length":2,"name":"test_response","type":"int64"}],"verification":[{"algorithm":"sha256","canonical_form":1,"digest":"7169b3668489db5ab1f914ee7f2b102a01d31a55f21ce9b89fc88ce526670ead"}]},"inputs":{"test":"testing-data","train":"training-data"},"options":{"duplicate_features":"error","feature_count":4,"index_base":1,"label_type":"int64","row_order":"source","target_name":"response"}},"schema_version":1,"source":"conformance","tasks":[{"name":"default","splits":{"test":{"features":"test_features","target":"test_response"},"train":{"features":"train_features","target":"train_response"}},"type":"classification"}],"title":"Small LIBSVM split conformance fixture","version":"1"},{"artifacts":[{"compression":"none","distribution":"upstream-only","downloads":[{"kind":"upstream","url":"https://example.invalid/datamonger/conformance/small-test.svmlight"}],"format":"svmlight","name":"data","sha256":"db6007bff9efaa468f44c20b485a51f92d794141dae44a490ac83aa721e7cb36","size":29}],"description":"Tiny sparse classification data using the SVMLight artifact format.","license":{"identifier":"CC0-1.0","status":"known"},"modality":"tabular","name":"small_svmlight","provenance":{"landing_page":"https://example.invalid/datamonger/conformance","provider":"Datamonger","retrieved_at":"2026-08-29","upstream_name":"small-test.svmlight"},"representation":{"decoder":"libsvm","decoder_version":1,"expect":{"components":[{"columns":4,"kind":"sparse_matrix","name":"features","rows":2,"type":"float64"},{"kind":"vector","length":2,"name":"response","type":"int64"}],"verification":[{"algorithm":"sha256","canonical_form":1,"digest":"708c9206dacf42a0f9df248c2175ea2940935ca0f1cb80e23910a458ecd93a0f"}]},"inputs":{"data":"data"},"options":{"duplicate_features":"error","feature_count":4,"index_base":1,"label_type":"int64","row_order":"source","target_name":"response"}},"schema_version":1,"source":"conformance","title":"Small SVMLight conformance fixture","version":"1"}],"defaults":[{"name":"mixed_csv","source":"conformance","version":"1"},{"name":"mixed_tsv","source":"conformance","version":"1"},{"name":"small_libsvm","source":"conformance","version":"1"},{"name":"small_libsvm_split","source":"conformance","version":"1"},{"name":"small_svmlight","source":"conformance","version":"1"}],"release":"test-0002","schema_version":1}
